Speaker,Role,Statement
Operator,Operator,Our last question is from Ben Bollin from Cleveland Research Company.
Ben Bollin,Analyst,"Tim, I'm interested in your thoughts and how you would have us think about the average useful life of these devices in the wild."
Ben Bollin,Analyst,"And in particular, curious, if you look at the strength you saw in fiscal ‘21 and how that might support accelerated refresh opportunity into the future?"
Tim Cook,Chief Executive Officer,"Ben, I think it's different for different types of users."
Tim Cook,Chief Executive Officer,I mean you have very early adopter kind of users that are very quick to jump on the latest technology that upgrade very frequently.
Tim Cook,Chief Executive Officer,And then you have people that are on the entire opposite side of that barbell.
Tim Cook,Chief Executive Officer,And most people are between those two points.
Tim Cook,Chief Executive Officer,"And so I do think there were lots of units that are sold during the COVID period of time, and it's a huge opportunity for us as a company to -- for more than one of the product categories."
